{
  "protocol_version": "0.1.0",
  "id": "node_child_002",
  "timestamp": "2026-04-05T22:35:00Z",
  "source": {
    "platform": "chatgpt",
    "url": "https://chatgpt.com/c/chat_id_123"
  },
  "graph": {
    "parent_id": "node_root_001", 
    "relation": "follow_up",
    "depth": 1
  },
  "payload": {
    "input": "How does this work with multithreading?",
    "output": {
      "raw": "In multithreading, Rust uses Send and Sync traits to ensure thread safety...",
      "content_type": "markdown"
    }
  }
}